{
  "id": "case-26",
  "title": "예·아니요를 직접 쓰고 그대로 둔 퀴즈 (모르겠어요와 같게 계산)",
  "note": "저장과 결제를 직접 쓰고 그대로 뒀다. 그대로 둔 답은 '모르겠어요'와 같아서 need.save가 붙지 않고 로그인·개인정보 질문을 묻지 않는다. '아마 그럴 거예요'(= 네)로 계산했다면 고를 것과 알아볼 것이 커진다(input.md 5.1절 결정 근거).",
  "answers": {
    "q.type": "quiz",
    "q.audience": "few",
    "q.ai": "chat-free",
    "q.save": "custom",
    "q.domain": "none",
    "q.budget": "free-only",
    "q.payment": "custom",
    "q.device": "phone",
    "q.style": "cute"
  },
  "notes": {
    "q.save": "점수는 화면에만 잠깐 보여 줘요",
    "q.payment": "참가비는 현장에서 받아요"
  },
  "cart": ["html-single", "github-pages"],
  "expect": {
    "asked": ["q.type", "q.audience", "q.ai", "q.save", "q.domain", "q.budget", "q.payment", "q.device", "q.style"],
    "tags": {
      "need.save": 0
    },
    "slots": [
      {
        "id": "slot.screen",
        "required": true,
        "recommended": "html-single",
        "filledBy": ["html-single"],
        "score": 4,
        "runnerUp": "react-vite",
        "reasons": ["aiTool", "budget"]
      },
      {
        "id": "slot.host",
        "required": true,
        "recommended": "github-pages",
        "filledBy": ["github-pages"],
        "score": 4,
        "runnerUp": "google-sheets-apps-script",
        "reasons": ["aiTool", "budget", "official"]
      }
    ],
    "conflicts": [],
    "canIssue": true,
    "research": ["research.copyright"],
    "safety": [],
    "study": {
      "required": ["deploy"],
      "all": ["deploy", "git-repo"]
    },
    "steps": ["slot.screen", "slot.host"],
    "prep": ["GitHub 가입"],
    "stuckRules": [],
    "difficulty": 3,
    "difficultyFirst": 3,
    "minutes": 80,
    "split": {
      "needed": false,
      "defer": [],
      "easier": []
    }
  }
}
