{
  "id": "case-28",
  "title": "목록에 없는 데이터 도구를 직접 쓴 포켓몬 도감 (처음부터 서행)",
  "note": "case-25와 같은 답에 외부 데이터 칸을 직접 쓴 도구 PokeAPI(custom-1)로 채웠다. 직접 쓴 도구는 처음부터 서행(kept)이라 출발을 막지 않고, 알아볼 것 research.custom:custom-1과 안전 지시 safety.custom-tool이 붙는다. 난이도는 1 + 2(모르는 도구) + 2, 시간은 기본 30 + 20 + 모름 60 + 30분.",
  "answers": {
    "q.type": "page",
    "q.audience": "anyone",
    "q.ai": "chat-free",
    "q.save": "no",
    "q.domain": "custom",
    "q.realtime": "daily",
    "q.budget": "free-only",
    "q.payment": "no",
    "q.device": "both",
    "q.style": "clean"
  },
  "notes": {
    "q.domain": "포켓몬 도감 정보"
  },
  "customTools": [
    {
      "id": "custom-1",
      "name": "PokeAPI",
      "capability": "data"
    }
  ],
  "cart": ["html-single", "custom-1", "github-pages"],
  "expect": {
    "asked": ["q.type", "q.audience", "q.ai", "q.save", "q.domain", "q.realtime", "q.budget", "q.payment", "q.device", "q.style"],
    "tags": {
      "need.data": 1
    },
    "slots": [
      {
        "id": "slot.screen",
        "required": true,
        "recommended": "html-single",
        "filledBy": ["html-single"],
        "score": 4,
        "runnerUp": "react-vite",
        "reasons": ["aiTool", "budget"]
      },
      {
        "id": "slot.data",
        "required": true,
        "recommended": null,
        "filledBy": ["custom-1"]
      },
      {
        "id": "slot.host",
        "required": true,
        "recommended": "github-pages",
        "filledBy": ["github-pages"],
        "score": 4,
        "runnerUp": "google-sheets-apps-script",
        "reasons": ["aiTool", "budget", "official"]
      }
    ],
    "conflicts": ["conflict.custom-tool:custom-1"],
    "canIssue": true,
    "research": ["research.custom:custom-1"],
    "safety": ["safety.custom-tool"],
    "study": {
      "required": ["deploy"],
      "all": ["deploy", "git-repo"]
    },
    "steps": ["slot.screen", "slot.data", "slot.host"],
    "prep": ["GitHub 가입"],
    "stuckRules": [],
    "difficulty": 5,
    "difficultyFirst": 5,
    "minutes": 140,
    "split": {
      "needed": false,
      "defer": [],
      "easier": []
    }
  }
}
