{
  "id": "case-30",
  "title": "직접 쓴 앱 종류에 빈틈: AI 챗봇 상담 (알아볼 것 끝에 빈틈 카드)",
  "note": "만들 것에 코드쇼퍼가 아직 도구를 골라 주지 못하는 바람(AI 기능)이 있다. 화면이 찾은 빈틈 ai-feature가 세션에 있으면 알아볼 것 맨 끝에 research.gap-ai-feature가 붙는다. 다른 기대값은 빈틈이 없을 때와 같다.",
  "answers": {
    "q.type": "custom",
    "q.audience": "me",
    "q.ai": "chat-free",
    "q.save": "no",
    "q.domain": "none",
    "q.notify": "no",
    "q.budget": "free-only",
    "q.device": "both",
    "q.style": "clean"
  },
  "notes": {
    "q.type": "AI 챗봇 상담"
  },
  "gaps": ["ai-feature"],
  "cart": ["html-single"],
  "expect": {
    "asked": ["q.type", "q.audience", "q.ai", "q.save", "q.domain", "q.notify", "q.budget", "q.device", "q.style"],
    "tags": {
      "type.custom": 1
    },
    "slots": [
      {
        "id": "slot.screen",
        "required": true,
        "recommended": "html-single",
        "filledBy": ["html-single"],
        "score": 4,
        "runnerUp": "react-vite",
        "reasons": ["aiTool", "budget"]
      },
      {
        "id": "slot.host",
        "required": false,
        "recommended": "github-pages",
        "filledBy": [],
        "score": 4,
        "runnerUp": "google-sheets-apps-script",
        "reasons": ["aiTool", "budget", "official"]
      }
    ],
    "conflicts": [],
    "canIssue": true,
    "research": ["research.gap-ai-feature"],
    "safety": [],
    "study": {
      "required": [],
      "all": []
    },
    "steps": ["slot.screen"],
    "prep": [],
    "stuckRules": [],
    "difficulty": 1,
    "difficultyFirst": 1,
    "minutes": 50,
    "split": {
      "needed": false,
      "defer": [],
      "easier": []
    }
  }
}
